{
  "schema": 1,
  "session_id": "3fa85f64-5717-4562-b3fc-2c963f66afa6",
  "cwd": "/home/me/code/sesshin",
  "transcript_path": "/home/me/.claude/projects/-home-me-code-sesshin/3fa85f64-5717-4562-b3fc-2c963f66afa6.jsonl",
  "session_title": "api review",
  "model": "claude-opus-5-5",
  "permission_mode": "acceptEdits",
  "pid": 554338,
  "pid_started_at": "linux:0f6c2a8e-9d1b-4c3a-8e7f-5b2d1a0c9e84:18446744",
  "entrypoint": "cli",
  "nested": false,
  "started_at": "2026-10-03T14:02:11Z",
  "last_start_at": "2026-10-03T16:40:05Z",
  "status": "waiting",
  "compactions": 2,
  "stall_reason": null,
  "background_tasks": 0,
  "session_crons": 0,
  "last_event_type": "stop",
  "last_event_at": "2026-10-03T18:31:51Z",
  "event_seq": 1287,
  "ended_prompt_id": "9b2e4c1a-7f3d-4e8b-a6c5-0d1f2e3a4b5c",
  "ended_at": null,
  "end_reason": null
}
